"1403","If often hotel miss","149","Kid before television unit ahead","PeachPuff","23","false","437.96","https://dummyimage.com/148x257"
"1404","Allow site wife tree","220","Do security","LightYellow","47","false","134.79","https://placeimg.com/719/549/any"
"1405","Treat audience","443","Program stage practice","Brown","99","false","197.23","https://placekitten.com/573/625"
"1406","Choose again","22","Already number local audience","Turquoise","93","false","218.21","https://dummyimage.com/784x36"
"1407","Two follow someone even","278","Protect drop five yourself young","YellowGreen","38","true","212.68","https://placeimg.com/917/133/any"
"1408","Where green","50","Security type development of","Lime","19","true","314.30","https://www.lorempixel.com/522/800"
"1409","Remain check","222","Remember specific","CornflowerBlue","23","false","252.51","https://placeimg.com/541/49/any"
"1410","Rock rather cover election become","42","Available education such","Aqua","93","true","417.87","https://dummyimage.com/683x803"
"1411","Daughter card news","124","Might special quality source hold","PowderBlue","29","false","83.29","https://placekitten.com/311/567"
"1412","Fear must eat cold","35","Pattern money through a open","Brown","36","true","152.48","https://www.lorempixel.com/941/217"
"1413","Speak first least","134","Break third Mrs","Fuchsia","23","true","489.75","https://placekitten.com/1000/914"
"1414","Watch explain back very work","332","And art move north carry","FireBrick","14","false","231.59","https://www.lorempixel.com/756/726"
"1415","Must agreement offer ok","131","Finally treatment real son","DeepPink","25","false","291.65","https://dummyimage.com/1022x969"
"1416","Meeting discover six skin by","19","Even even control save","Gold","7","true","367.61","https://placekitten.com/170/6"
"1417","Pay three each difference","485","Do cold","LightBlue","52","true","60.86","https://placeimg.com/540/875/any"
"1418","Machine less north","274","Suffer attention key","Lime","59","true","490.27","https://dummyimage.com/499x510"
"1419","Strong final three police federal","202","Discussion mission too time","Lavender","97","false","125.55","https://placeimg.com/24/322/any"
"1420","Who challenge area century","247","Deep front reflect medical","LightSteelBlue","41","true","238.16","https://dummyimage.com/2x105"
"1421","Everybody control service war responsibility","50","Clearly country","Orange","21","false","285.73","https://www.lorempixel.com/210/854"
"1422","Interest body","358","Yet in","Navy","41","false","444.76","https://dummyimage.com/966x232"
"1423","Not me image","393","Expect institution someone woman","Olive","93","true","210.14","https://dummyimage.com/477x19"
"1424","Say thousand support","314","This billion cost","CornflowerBlue","29","false","216.26","https://placekitten.com/529/478"
"1425","Space state movement","432","Central through Republican","DarkViolet","4","true","300.40","https://placekitten.com/855/849"
"1426","Rather record use by offer","495","Book visit various soon","FloralWhite","36","false","155.20","https://www.lorempixel.com/624/961"
"1427","Develop rather which good","295","Mean peace computer series rock","Violet","33","true","149.40","https://www.lorempixel.com/398/670"
"1428","Decade evidence hard protect act","452","Amount project","Ivory","3","false","194.77","https://placeimg.com/742/636/any"
"1429","Doctor lawyer player course","320","Very hair","Teal","100","true","286.24","https://www.lorempixel.com/325/206"
"1430","I meet vote first usually","316","Once determine election","PaleGoldenRod","2","false","88.57","https://dummyimage.com/247x788"
"1431","Serious name assume","350","Age language table drug","Snow","83","false","392.27","https://dummyimage.com/802x661"
"1432","Would our","291","Benefit which wall face","DarkGray","65","true","431.46","https://www.lorempixel.com/358/85"
"1433","Bit technology hundred","362","Dark likely use","SeaShell","86","false","432.66","https://placekitten.com/513/212"
"1434","Chair clearly play north","117","Response foreign at determine","MintCream","9","false","366.49","https://placeimg.com/218/561/any"
"1435","Before later address","456","Data parent me unit","DimGray","1","true","201.94","https://placekitten.com/258/279"
"1436","Station property","91","Race final maybe only way","SkyBlue","35","true","268.01","https://dummyimage.com/513x41"
"1437","Position themselves window","177","Several speak modern seek","LightCoral","51","false","289.96","https://placekitten.com/856/924"
"1438","Deep build technology west","489","Million perform college low","DarkOliveGreen","88","false","360.56","https://placeimg.com/616/928/any"
"1439","Debate consider avoid","347","Newspaper find ask someone","Chartreuse","13","true","133.46","https://placeimg.com/35/430/any"
"1440","Oil would worker","134","Prepare where","Moccasin","2","true","191.00","https://placeimg.com/150/549/any"
"1441","Fast wonder energy","311","Social wife special if both","PaleVioletRed","11","true","245.10","https://placeimg.com/226/524/any"
"1442","Eight visit expert","173","Affect million live set","DarkGray","75","true","451.64","https://www.lorempixel.com/142/186"
"1443","Act story","347","Half cover own","LightSeaGreen","16","false","338.60","https://placeimg.com/411/446/any"
"1444","War hit wear stop","92","Return three hundred","Turquoise","30","true","102.31","https://dummyimage.com/1010x188"
"1445","Relationship help play town","319","Plant PM","LimeGreen","1","false","78.73","https://placeimg.com/571/97/any"
"1446","Page view American political","1","Project stay","RoyalBlue","62","true","280.33","https://placeimg.com/550/195/any"
"1447","Change hundred little","49","Nation PM item","DarkMagenta","83","true","257.58","https://dummyimage.com/65x811"
"1448","Reason seven pattern believe condition","87","Unit when","NavajoWhite","37","false","413.24","https://placekitten.com/536/704"
"1449","Maybe play where","125","Risk approach page","Thistle","35","true","282.36","https://www.lorempixel.com/174/727"
"1450","Exist entire","412","Even doctor room then","OliveDrab","87","false","1.96","https://placekitten.com/425/369"
"1451","Somebody moment such tonight","123","Through technology","YellowGreen","74","true","5.72","https://placekitten.com/215/463"
"1452","Modern fact those image sort","276","Hot fund","YellowGreen","66","true","132.25","https://placeimg.com/28/711/any"
"1453","Above step happy let","10","Anyone allow","Moccasin","38","true","381.72","https://placeimg.com/628/740/any"
"1454","Region field expect adult sense","207","Everything listen perhaps note expect","Chartreuse","67","true","320.18","https://www.lorempixel.com/808/948"
"1455","Myself before there","386","South this race strong seem","Aquamarine","67","true","430.67","https://placeimg.com/142/184/any"
"1456","Somebody glass increase","442","Within soldier society baby tough","Orchid","76","true","268.57","https://placeimg.com/858/453/any"
"1457","Art name watch","435","Appear artist air loss","DarkRed","60","false","207.45","https://www.lorempixel.com/859/192"
"1458","Wrong rich half return address","33","Discuss west goal","LightGoldenRodYellow","9","true","325.74","https://placeimg.com/33/656/any"
"1459","Lawyer draw indeed yes","350","These tax arm just tell","Orchid","50","false","399.14","https://placeimg.com/630/832/any"
"1460","Enough effect because staff great","345","Material ok weight","OldLace","26","false","37.77","https://placekitten.com/256/70"
"1461","Him analysis full right","46","Among to","DarkKhaki","95","false","459.56","https://www.lorempixel.com/338/330"
"1462","Reflect give sign","144","Sign most","Indigo","83","false","456.56","https://placekitten.com/694/570"
"1463","Short performance","49","Anyone remember common","Blue","65","true","3.44","https://www.lorempixel.com/850/520"
"1464","Whole way","394","Nature thus too","PaleGreen","98","true","123.30","https://placeimg.com/1018/394/any"
"1465","Home both management president","375","Ten key ok","Aquamarine","82","true","105.92","https://placeimg.com/765/26/any"
"1466","Mission rate statement matter","8","Across ago majority","FireBrick","85","true","443.67","https://placeimg.com/628/83/any"
"1467","Personal accept boy another","499","Indeed dream ago her","Cyan","24","true","135.81","https://placeimg.com/168/684/any"
"1468","Analysis information call budget defense","464","Education tree tree oil outside","DeepPink","50","true","456.48","https://www.lorempixel.com/763/707"
"1469","Evidence poor court computer","241","Lead step medical increase star","DarkBlue","5","true","415.01","https://placeimg.com/2/517/any"
"1470","Better yes team way","170","Fast natural too board","GreenYellow","33","true","382.02","https://www.lorempixel.com/636/936"
"1471","Prevent last like fact","469","Discussion hospital far safe","Red","96","false","55.49","https://dummyimage.com/413x49"
"1472","Another tough parent","249","Agreement wonder officer his thousand","DarkRed","60","true","182.32","https://placeimg.com/617/839/any"
"1473","Name hair boy protect","63","Much yourself","Silver","21","true","447.02","https://placekitten.com/271/217"
"1474","Offer real of","237","Blue certain","DarkCyan","48","true","289.82","https://www.lorempixel.com/264/42"
"1475","However near item","101","See easy","OrangeRed","2","true","107.84","https://dummyimage.com/230x199"
"1476","Across owner example","51","Protect risk citizen second democratic","Crimson","7","false","483.59","https://placeimg.com/36/128/any"
"1477","Process long","394","Almost instead away","Lime","82","true","236.33","https://placeimg.com/790/961/any"
"1478","Professional citizen","193","Present sing physical grow order","DarkGreen","63","true","454.70","https://placeimg.com/132/133/any"
"1479","Authority green","414","Easy figure culture fine mouth","Green","79","true","318.15","https://dummyimage.com/236x435"
"1480","Year born throughout","296","Of man","Magenta","87","false","435.43","https://www.lorempixel.com/511/975"
"1481","Or many responsibility might as","327","Glass take late tell","DimGray","88","true","459.92","https://dummyimage.com/324x34"
"1482","Explain affect effect baby","3","Raise head ask","Tomato","54","true","34.20","https://www.lorempixel.com/745/956"
"1483","Best hour eight","42","After hear feel provide strong","DarkBlue","95","true","278.16","https://dummyimage.com/210x73"
"1484","Plant total","460","Face world","Green","62","false","302.32","https://www.lorempixel.com/505/545"
"1485","American bed must number","411","Me add","DarkSalmon","0","false","289.30","https://dummyimage.com/384x224"
"1486","Customer opportunity within tree","329","Nor thing kid","Silver","18","false","483.19","https://placekitten.com/914/836"
"1487","Modern again now","286","Laugh news","Wheat","84","false","215.70","https://www.lorempixel.com/456/706"
"1488","Term structure popular deal","463","Reach usually","ForestGreen","54","true","103.44","https://dummyimage.com/286x827"
"1489","Them throw","76","High heart simply","MediumSlateBlue","29","true","342.76","https://placekitten.com/868/386"
"1490","Relationship news test","79","Add effort often","OrangeRed","57","true","389.78","https://placekitten.com/455/267"
"1491","Building physical","325","Sense join lay feeling perform","MediumBlue","11","false","283.86","https://placeimg.com/645/867/any"
"1492","Staff national particularly","357","Day hear quite floor","PapayaWhip","81","false","345.40","https://dummyimage.com/450x626"
"1493","Always fire real","97","Wonder ahead prepare its","DarkKhaki","55","true","453.35","https://dummyimage.com/348x498"
"1494","Example sing","322","Much eye memory her although","OrangeRed","63","false","400.00","https://www.lorempixel.com/284/668"
"1495","Shake it be hundred","341","Size science","Thistle","8","false","57.25","https://www.lorempixel.com/989/896"
"1496","Serious quality","14","Animal public wish example","LightSeaGreen","2","false","362.93","https://placekitten.com/319/50"
"1497","Sit operation service","492","Environment control toward","IndianRed","45","true","338.11","https://placekitten.com/554/412"
"1498","Try institution hospital to from","172","Money success feeling building half","SlateBlue","99","true","353.22","https://www.lorempixel.com/54/467"
"1499","Coach science people nature","212","Common police view consumer","MediumSlateBlue","34","true","287.01","https://dummyimage.com/390x334"
"1500","Magazine be individual choose sing","108","Executive away natural guess","DarkOrange","90","false","246.63","https://dummyimage.com/614x5"
"1501","Address knowledge teacher bag glass","490","Practice look special","LightCoral","33","true","204.75","https://placekitten.com/496/1018"
"1502","Let task provide","377","Fast follow realize","CornflowerBlue","76","false","122.11","https://placekitten.com/773/137"
"1503","Land computer really","280","World reality","PowderBlue","39","true","194.34","https://placeimg.com/908/15/any"
"1504","Night look series","208","Soldier beyond nice whatever","PowderBlue","12","true","313.88","https://www.lorempixel.com/782/209"
"1505","Find white police something skill","362","Together thus","MistyRose","7","false","173.78","https://dummyimage.com/70x361"
"1506","Beat ask meet person","305","Officer parent experience","MediumTurquoise","93","true","22.46","https://placekitten.com/601/78"
"1507","Near picture soldier matter","343","At before","LightCoral","21","true","290.78","https://dummyimage.com/248x680"
"1508","Sea since next network","179","Me onto parent eat","Crimson","44","false","390.56","https://placeimg.com/196/226/any"
"1509","College newspaper","442","Shake and hot old mother","Aquamarine","17","true","329.78","https://placekitten.com/444/272"
"1510","Growth think","161","Tough figure life miss","MediumSlateBlue","37","true","187.79","https://placeimg.com/133/866/any"
"1511","We recent whether","192","Student big","CadetBlue","32","true","207.16","https://placekitten.com/960/74"
"1512","Democratic as","471","Do whatever million","FloralWhite","79","false","415.91","https://placekitten.com/762/920"
"1513","Return kid this field","111","Morning shake","PowderBlue","19","true","53.11","https://www.lorempixel.com/608/994"
"1514","Understand product big argue","487","Woman education represent important follow","MistyRose","75","true","277.88","https://placekitten.com/986/447"
"1515","Free year answer industry","481","Company next turn","GreenYellow","12","true","493.73","https://placeimg.com/532/629/any"
"1516","Enough audience hope you project","274","Subject future","Chartreuse","54","false","202.05","https://placekitten.com/711/1014"
"1517","Material style since free capital","474","Memory wonder quality guess","SeaGreen","75","false","417.38","https://placekitten.com/326/794"
"1518","Know stand wear onto","352","Ability fast business we","RosyBrown","73","false","409.82","https://www.lorempixel.com/386/62"
"1519","Somebody program kid meet top","364","Table this relate","Peru","71","true","424.03","https://www.lorempixel.com/27/222"
"1520","Issue at knowledge soldier","466","Road within","GreenYellow","46","false","328.72","https://placeimg.com/767/369/any"
"1521","Dark huge discuss arm","496","Nice since involve yes","DeepPink","2","true","76.31","https://dummyimage.com/368x616"
"1522","Hear degree recognize position tough","118","Social may","LightCoral","17","true","194.84","https://placeimg.com/791/203/any"
"1523","Single machine herself","107","Deal serve despite Mr","LawnGreen","40","false","220.05","https://placekitten.com/636/165"
"1524","Point end","290","Sing this letter ago","RosyBrown","1","false","447.41","https://www.lorempixel.com/608/108"
"1525","World similar","368","Daughter focus gas","SpringGreen","19","true","131.82","https://placeimg.com/973/779/any"
"1526","Both without","136","Road would stock","SeaGreen","97","false","38.82","https://placeimg.com/989/473/any"
"1527","Class lay","220","Prepare senior these play left","DarkMagenta","27","true","442.20","https://www.lorempixel.com/149/538"
"1528","Station care instead","141","Three hour ball offer","AntiqueWhite","43","true","400.67","https://placeimg.com/14/974/any"
"1529","Girl story reflect","86","Finally public","Gray","67","true","210.46","https://www.lorempixel.com/155/335"
"1530","Number mention authority glass","437","Various choice agent","DarkCyan","55","false","305.45","https://placekitten.com/804/641"
"1531","Free get total","494","Trip executive paper","LightCyan","17","false","499.65","https://www.lorempixel.com/1/665"
"1532","Once seek form","56","Always more cover","DarkGoldenRod","30","true","4.86","https://placeimg.com/214/5/any"
"1533","Ability what treatment","74","Type country discover my behavior","LightYellow","31","false","230.17","https://placekitten.com/810/178"
"1534","Hold lead like","82","Ball goal","LightCyan","67","false","184.70","https://placekitten.com/921/322"
"1535","Guy remain whatever","262","Kitchen score better","LimeGreen","46","false","167.69","https://placekitten.com/857/230"
"1536","Group entire worker","232","Along health may","DarkOrange","98","false","90.06","https://placekitten.com/828/517"
"1537","Would fly interest performance","157","Issue way decade","BlanchedAlmond","7","false","408.95","https://www.lorempixel.com/375/410"
"1538","Foreign decide parent pattern election","160","Under back leave sport our","DodgerBlue","0","false","119.10","https://placeimg.com/730/348/any"
"1539","Use small","492","Responsibility industry care position","Pink","4","false","44.84","https://placeimg.com/909/968/any"
"1540","Interview region","363","Enough tell eye blood","SlateBlue","82","false","421.51","https://dummyimage.com/111x310"
"1541","Former reveal evidence around","422","Choice town early","BurlyWood","43","false","86.02","https://www.lorempixel.com/1003/43"
"1542","Him resource","14","Newspaper member score increase","Lime","37","false","302.61","https://placeimg.com/994/695/any"
"1543","State case middle","144","Protect care any how situation","Chocolate","35","true","365.59","https://placeimg.com/27/811/any"
"1544","Catch main training style","94","Individual listen","HoneyDew","59","true","349.32","https://dummyimage.com/579x713"
"1545","Though across medical","2","Least green wall","CornflowerBlue","44","false","443.12","https://www.lorempixel.com/903/139"
"1546","Style expect attorney","228","High office","DarkViolet","9","true","122.08","https://www.lorempixel.com/70/811"
"1547","Whom thought action picture","215","Establish attorney imagine ground","LightPink","80","true","191.32","https://dummyimage.com/550x547"
"1548","Coach that apply right third","462","Everyone month shoulder case","Magenta","55","false","419.95","https://placeimg.com/273/202/any"
"1549","Drug fire even","0","Best wall cell performance us","YellowGreen","19","true","427.94","https://dummyimage.com/779x120"
"1550","Level someone result","462","View customer","Crimson","47","true","184.56","https://www.lorempixel.com/653/514"
"1551","Candidate represent tree nice fast","492","Throughout guy believe yard station","DarkSeaGreen","40","true","476.43","https://placeimg.com/638/24/any"
"1552","Radio bed today attack","309","Nature sit better close","OldLace","64","true","4.24","https://dummyimage.com/304x1008"
"1553","Leg certainly","432","Government budget dog","DarkTurquoise","78","true","147.00","https://dummyimage.com/317x362"
"1554","Brother sound most along resource","379","Guy husband choice thank themselves","IndianRed","20","false","178.91","https://placekitten.com/117/55"
"1555","Maintain drop","107","Raise wear","DarkMagenta","7","false","76.24","https://placekitten.com/186/269"
"1556","Either from listen","347","Generation never","Crimson","46","false","2.77","https://dummyimage.com/524x569"
"1557","Each lot very really","186","Note allow week news","BlueViolet","86","false","372.40","https://dummyimage.com/75x632"
"1558","Social senior lose manage","260","Term lay meet","FloralWhite","93","true","476.79","https://www.lorempixel.com/13/1020"
"1559","Computer point run","461","Part but situation national","LemonChiffon","22","false","163.80","https://www.lorempixel.com/967/452"
"1560","Without toward impact material","451","Training inside product","LightSkyBlue","85","true","291.19","https://placekitten.com/361/420"
"1561","Lawyer vote structure","24","Quickly general popular trip","RosyBrown","55","false","292.05","https://placeimg.com/761/916/any"
"1562","Hotel place become other design","310","Television word respond goal","Teal","80","true","77.27","https://dummyimage.com/641x483"
"1563","From Mr theory chance follow","409","Firm positive next kitchen","White","69","false","294.79","https://dummyimage.com/644x136"
"1564","Home recently perform staff","310","Sport option fly card throughout","Thistle","37","true","59.26","https://www.lorempixel.com/956/476"
"1565","Great hand chair star","46","Boy seek up food","LightSalmon","39","false","460.45","https://placeimg.com/155/381/any"
"1566","Watch make result human","422","Prevent road","SeaGreen","54","true","195.09","https://www.lorempixel.com/549/42"
"1567","Herself behavior physical source","184","See condition sister","Teal","96","true","285.26","https://dummyimage.com/185x998"
"1568","Word value tonight","363","Director last eat economy state","Ivory","37","false","86.25","https://www.lorempixel.com/970/602"
"1569","Group near show money","457","Away north","MintCream","75","true","183.95","https://www.lorempixel.com/80/779"
"1570","Century determine never commercial","15","Fire computer","PowderBlue","15","true","394.48","https://placekitten.com/669/153"
"1571","Open suggest institution small","349","Film marriage","DarkMagenta","20","false","20.78","https://dummyimage.com/573x357"
"1572","Write fill seat series fast","34","Event specific yourself morning professional","White","32","false","299.80","https://placekitten.com/598/612"
"1573","Strong view sometimes","213","Our life condition","PeachPuff","99","false","271.05","https://dummyimage.com/31x1020"
"1574","Response account","262","Late give travel business sound","MediumTurquoise","84","true","141.16","https://www.lorempixel.com/296/129"
"1575","Financial share","208","Church painting care benefit","Snow","84","false","354.87","https://dummyimage.com/577x813"
"1576","Size drive","463","Finish land music","LightSteelBlue","1","false","268.30","https://www.lorempixel.com/71/232"
"1577","Minute beyond center","361","Clearly seem great","Fuchsia","84","false","140.28","https://placekitten.com/331/622"
"1578","Loss certain","316","Green begin argue voice off","Orange","56","false","29.16","https://www.lorempixel.com/959/239"
"1579","Fear will bad","214","Own they","DarkRed","93","false","257.09","https://placekitten.com/902/664"
"1580","Feeling leave whatever indeed","430","Campaign enjoy history themselves and","Bisque","0","false","134.07","https://dummyimage.com/13x457"
"1581","Different heart","487","Meeting decision between care billion","Violet","68","false","476.42","https://dummyimage.com/842x2"
"1582","Nation house those join same","11","Blue see red","RoyalBlue","77","false","160.93","https://placekitten.com/864/536"
"1583","Over effort","22","Election history","DeepSkyBlue","95","false","29.42","https://dummyimage.com/408x705"
"1584","Bed work","140","Agree ago chair","LemonChiffon","8","false","131.03","https://dummyimage.com/638x371"
"1585","Picture we similar","347","Building able sister","BurlyWood","7","true","53.90","https://www.lorempixel.com/330/796"
"1586","Up exactly least","422","Everybody instead","SteelBlue","28","true","317.52","https://placekitten.com/467/354"
"1587","Happy myself these see","75","Society like","Navy","57","true","244.77","https://dummyimage.com/69x579"
"1588","Citizen heart","185","Already challenge develop treat","Navy","2","true","444.66","https://www.lorempixel.com/164/396"
"1589","Because stock class","51","Something hard through","Purple","26","false","373.04","https://www.lorempixel.com/185/122"
"1590","Ago which second","291","His marriage real throw","LightPink","22","true","4.14","https://placekitten.com/375/309"
"1591","Floor situation","350","Adult cause radio","OldLace","3","false","142.35","https://placeimg.com/782/455/any"
"1592","Expert that office establish continue","272","Push order feeling","OrangeRed","25","true","298.34","https://dummyimage.com/652x296"
"1593","Reach suddenly back","432","College meeting available like","Teal","51","true","119.94","https://www.lorempixel.com/156/953"
"1594","Best police speak purpose rise","224","Second bad","CadetBlue","7","false","289.89","https://www.lorempixel.com/831/509"
"1595","Education will reveal","345","Start blood who actually","Chartreuse","54","true","276.87","https://www.lorempixel.com/125/306"
"1596","Piece meet plant Congress","2","Open election recent human","SlateGray","59","false","246.10","https://www.lorempixel.com/461/99"
"1597","Piece land rather","212","Have history short several","Purple","53","true","9.89","https://www.lorempixel.com/676/448"
"1598","Couple computer check","348","Song recently","BurlyWood","16","false","171.23","https://dummyimage.com/15x551"
"1599","Meeting minute item bad good","433","Whom black affect","LightYellow","97","false","446.64","https://www.lorempixel.com/58/769"
"1600","Even amount particular option point","328","Past raise","Azure","17","false","155.86","https://placeimg.com/638/209/any"
"1601","Send only space forget book","489","Whole thus child manager","Bisque","13","false","123.31","https://dummyimage.com/766x71"
"1602","Still station quite","79","Economy college cup training","SeaShell","72","true","228.39","https://placekitten.com/453/1023"
"1603","Ball easy believe personal","390","Suffer wish city view","DarkGoldenRod","45","true","29.32","https://placeimg.com/287/388/any"
