"0","Whatever it","200","Trip dream usually people","DarkOliveGreen","87","false","436.15","https://placekitten.com/504/511"
"1","Man meeting way common yourself","257","Wrong million that computer way","OrangeRed","86","false","477.93","https://placeimg.com/124/662/any"
"2","Recently health carry natural image","154","Another decide response purpose several","LightYellow","2","false","345.48","https://placekitten.com/219/30"
"3","Do card current","14","Show upon require","Turquoise","66","true","321.76","https://www.lorempixel.com/895/154"
"4","Home order position","287","Bring raise","BurlyWood","27","true","31.94","https://dummyimage.com/892x199"
"5","Ago power responsibility","250","Treat glass enter I now","Beige","36","true","257.46","https://www.lorempixel.com/582/326"
"6","Wrong smile enter result","409","Admit end leave","LightSalmon","61","true","119.02","https://dummyimage.com/512x341"
"7","Lead way describe","417","Conference cultural huge yes","GoldenRod","92","true","242.53","https://placekitten.com/137/648"
"8","All indeed","36","Necessary campaign indicate middle security","Magenta","2","false","11.49","https://www.lorempixel.com/838/777"
"9","Moment watch fly","13","Him town green","BlueViolet","52","true","205.84","https://www.lorempixel.com/174/981"
"10","Yard wrong mention such over","91","Country its","DarkGoldenRod","44","false","18.84","https://www.lorempixel.com/897/906"
"11","Series site look","159","Another enter before somebody produce","MediumSpringGreen","8","true","161.61","https://placeimg.com/457/935/any"
"12","Nor black huge leave reach","50","Pick skin","Turquoise","2","true","433.28","https://www.lorempixel.com/768/909"
"13","Couple dog","92","Open wish","Silver","62","true","249.19","https://dummyimage.com/34x36"
"14","Third boy these","119","Cover everybody east","Magenta","36","true","265.53","https://placeimg.com/524/855/any"
"15","Research week seek","216","Human win but","DarkRed","43","true","217.28","https://placeimg.com/286/201/any"
"16","Themselves party information million","380","Point fill","MistyRose","38","false","62.79","https://www.lorempixel.com/409/210"
"17","Move else market","271","Thus any lose reveal under","GreenYellow","21","false","488.17","https://placeimg.com/444/214/any"
"18","Interview both fear skin","75","Contain involve","MediumVioletRed","12","false","41.83","https://placeimg.com/556/53/any"
"19","Similar professor soldier","325","Best enough material front","Sienna","55","false","360.91","https://placeimg.com/79/646/any"
"20","Firm management financial establish relationship","406","Work most few available pass","BlueViolet","28","false","60.01","https://placeimg.com/798/364/any"
"21","Point fire","299","Offer to second method","Peru","43","true","167.85","https://placeimg.com/409/544/any"
"22","Direction smile later","71","Modern national attorney","Crimson","83","false","72.77","https://placekitten.com/949/574"
"23","Home story","48","Weight why from","FireBrick","14","true","388.90","https://placekitten.com/218/72"
"24","Evening themselves big","127","Film purpose","Ivory","83","true","396.33","https://placeimg.com/164/566/any"
"25","Organization not rich them","115","Shoulder culture way","RoyalBlue","13","true","471.09","https://dummyimage.com/149x306"
"26","Economic determine loss","95","Travel eight especially safe","Pink","30","true","389.84","https://www.lorempixel.com/78/5"
"27","Responsibility happen goal","143","Bit lot response","Tomato","55","true","200.50","https://dummyimage.com/254x30"
"28","Never respond although stand single","361","Very officer hard loss family","PaleVioletRed","72","false","89.49","https://placeimg.com/461/662/any"
"29","Seat at us popular","57","Happen after fall","Black","37","true","406.91","https://placeimg.com/955/372/any"
"30","Effect down everything agent","182","Suffer friend","SpringGreen","42","false","196.14","https://dummyimage.com/310x1010"
"31","Attention if","418","Congress interview campaign attention","Coral","92","false","482.80","https://placeimg.com/663/900/any"
"32","Can commercial major country","118","Hard true","Indigo","38","false","75.17","https://placeimg.com/258/705/any"
"33","From apply collection","155","Close such mother around","GreenYellow","85","false","416.64","https://placekitten.com/473/446"
"34","Arrive ready yard","71","Believe win quickly easy shake","MediumOrchid","93","false","328.31","https://placeimg.com/888/868/any"
"35","Be change brother create","215","Article soon situation","DarkCyan","51","true","89.61","https://dummyimage.com/583x190"
"36","Better field grow rule","123","Affect want center science","LightGreen","34","false","125.41","https://placekitten.com/474/177"
"37","Push bad","170","Should shake myself","YellowGreen","36","true","124.34","https://www.lorempixel.com/570/184"
"38","Blue by street mother","36","Blood modern coach truth","DarkTurquoise","31","false","240.91","https://placekitten.com/307/541"
"39","Seven TV seem past","31","Mention deal check right","LemonChiffon","4","false","255.30","https://www.lorempixel.com/772/1000"
"40","Great worker decade","499","Republican for voice","Purple","17","false","173.68","https://placeimg.com/883/920/any"
"41","Shoulder tax area","436","Forward practice other various","NavajoWhite","68","false","241.27","https://www.lorempixel.com/864/487"
"42","Happy almost","278","Hear hour on","Beige","23","true","270.21","https://dummyimage.com/527x322"
"43","Film provide us","387","Thus movement them","MediumVioletRed","4","false","160.30","https://www.lorempixel.com/986/76"
"44","School one family","18","Current already candidate form glass","Ivory","6","true","408.09","https://dummyimage.com/763x771"
"45","Imagine help","32","If short great those store","MediumSeaGreen","46","false","31.00","https://dummyimage.com/1009x393"
"46","Future attention attorney actually","366","Take campaign","MediumSpringGreen","15","false","94.01","https://www.lorempixel.com/326/843"
"47","Early teach answer so industry","227","Win treat probably front","BlanchedAlmond","74","false","405.84","https://placekitten.com/997/757"
"48","Begin benefit","491","Left social","DimGray","41","false","382.22","https://www.lorempixel.com/206/888"
"49","Themselves very with cultural","387","Entire work yes mind development","PaleVioletRed","4","true","374.67","https://www.lorempixel.com/378/788"
"50","Become door whatever yet","437","Sign throughout","LemonChiffon","36","true","79.17","https://placeimg.com/184/666/any"
"51","Seem somebody but we walk","449","Issue look drive","LightSkyBlue","83","true","443.70","https://www.lorempixel.com/701/377"
"52","Recognize he","342","Central market","MediumBlue","20","false","257.06","https://www.lorempixel.com/353/597"
"53","Word build pressure because","447","Prove true","DarkMagenta","28","false","323.55","https://placekitten.com/601/65"
"54","Share population","163","History another always serve","Green","70","true","172.90","https://placeimg.com/557/340/any"
"55","Development participant","20","Threat plan rich attorney notice","DarkTurquoise","9","false","397.01","https://www.lorempixel.com/474/160"
"56","According degree turn week","87","Cut since important","Bisque","73","false","76.33","https://www.lorempixel.com/504/537"
"57","Loss year development subject","36","Seven exist top hear","Teal","62","false","12.93","https://dummyimage.com/225x483"
"58","Price would baby lay","405","Quite those during head so","HotPink","80","true","209.14","https://www.lorempixel.com/336/638"
"59","Life draw never","4","Seven film radio administration method","PaleGreen","28","false","450.25","https://placekitten.com/168/153"
"60","Consider ten ready","62","Mr fill computer fine","DarkSeaGreen","49","false","139.59","https://placeimg.com/645/758/any"
"61","Case size behind huge moment","177","Consider add stock well","Blue","15","false","372.81","https://placekitten.com/372/868"
"62","Everyone adult page","148","Participant better reduce","White","32","true","387.50","https://www.lorempixel.com/240/349"
"63","White live alone hotel","476","Experience resource major while","PaleGreen","31","false","132.49","https://placekitten.com/909/6"
"64","Rise heart picture","21","Control glass wish against","SandyBrown","67","false","362.51","https://dummyimage.com/797x911"
"65","Suggest high","310","Itself own talk ok","NavajoWhite","5","false","14.07","https://placeimg.com/294/944/any"
"66","Sister benefit professor","118","Ago dark in suggest sing","MintCream","19","false","430.02","https://www.lorempixel.com/331/453"
"67","Up amount list","138","Leg plant response trade","LightSalmon","58","true","429.15","https://placeimg.com/416/843/any"
"68","Receive including he too","260","Civil blood reality","DarkBlue","32","false","450.85","https://www.lorempixel.com/0/343"
"69","Whose ahead","20","East data","Maroon","100","true","85.33","https://www.lorempixel.com/956/1014"
"70","Product back throw senior feeling","53","Middle really hand trade","MediumBlue","78","true","331.14","https://placekitten.com/170/756"
"71","Reveal career","491","Short number number","Salmon","3","true","97.44","https://placekitten.com/734/494"
"72","Wait wide","75","Kind structure","Thistle","54","false","420.67","https://placekitten.com/328/20"
"73","Thank road risk line","175","Fly matter finally behavior hear","Turquoise","22","false","292.88","https://placeimg.com/901/877/any"
"74","Our commercial Mrs","417","Fight dark natural full","DarkSeaGreen","78","false","351.35","https://dummyimage.com/283x217"
"75","Success among including push","298","Any radio","LightSeaGreen","82","false","88.40","https://dummyimage.com/705x925"
"76","Generation exist","60","Student best student report","MediumAquaMarine","69","true","172.31","https://placekitten.com/370/550"
"77","Total interesting two","238","Even audience","Purple","21","false","79.94","https://placeimg.com/489/609/any"
"78","Power interest help trip result","343","Speech party put sing","Thistle","81","false","263.04","https://placekitten.com/129/366"
"79","Indicate term develop","39","Court check plant","MediumOrchid","11","true","195.93","https://www.lorempixel.com/556/625"
"80","Cup operation somebody white","26","Lot common city","LightGreen","54","true","500.47","https://dummyimage.com/631x372"
"81","Movie my throw first same","70","Board skin media realize","DarkSlateBlue","37","true","225.62","https://placeimg.com/953/953/any"
"82","Sound nation reveal","459","Both important add true","Yellow","92","false","47.18","https://dummyimage.com/948x1010"
"83","Inside bill","13","Born perhaps personal","LightBlue","71","false","229.52","https://dummyimage.com/87x292"
"84","Above go environmental mother what","216","Cost whose enter family","DarkBlue","8","false","379.20","https://placekitten.com/723/852"
"85","Issue professor work","289","Police actually","HotPink","10","true","277.20","https://www.lorempixel.com/691/286"
"86","Next stage I nor","262","Indeed allow","MediumOrchid","56","true","356.85","https://dummyimage.com/517x35"
"87","Business although","483","Ability establish form next thousand","Gainsboro","3","false","429.84","https://placeimg.com/486/582/any"
"88","Sense trial reason","151","Write opportunity south up","SpringGreen","32","false","197.17","https://www.lorempixel.com/632/319"
"89","Trip these like arm","142","Free particularly food","DarkSeaGreen","60","false","254.25","https://www.lorempixel.com/749/383"
"90","Huge say dinner return","242","American recent safe pattern","MediumBlue","35","true","18.41","https://placeimg.com/855/445/any"
"91","Figure note southern","165","Gas hold everything we","Yellow","12","true","426.50","https://www.lorempixel.com/83/399"
"92","Enjoy film well lay down","319","Mouth every out","LawnGreen","54","false","455.81","https://placekitten.com/728/747"
"93","Could term those similar offer","483","Dog animal thank","DodgerBlue","90","false","156.80","https://dummyimage.com/834x497"
"94","Market describe suffer four may","382","Reality something name","HoneyDew","93","true","456.26","https://placekitten.com/911/180"
"95","Product feeling as daughter","446","Improve pull","LightPink","58","false","64.79","https://placekitten.com/322/362"
"96","Low stock","48","Perform wait same them film","Navy","57","true","130.98","https://www.lorempixel.com/687/4"
"97","Project ok others away","112","Art drive response central drop","Orchid","93","false","450.95","https://placekitten.com/542/752"
"98","Before letter student team","130","Site fish forward risk","LightYellow","44","false","125.65","https://www.lorempixel.com/92/628"
"99","Agree admit start","494","Road including catch reflect measure","MediumSpringGreen","64","false","489.81","https://placeimg.com/662/679/any"
"100","Eat us maintain","380","Room three job bit","LimeGreen","50","true","363.68","https://placekitten.com/101/93"
"101","Compare field open others","41","Clear and whom weight three","DeepSkyBlue","22","true","478.04","https://dummyimage.com/504x1003"
"102","Gas support","42","Both treat me structure father","DarkMagenta","87","false","403.84","https://placeimg.com/817/247/any"
"103","Along attorney billion check party","427","News start rise attack month","LemonChiffon","73","false","319.57","https://placeimg.com/810/207/any"
"104","Agree share physical on establish","54","Contain I minute deep","MintCream","44","false","286.68","https://placeimg.com/539/703/any"
"105","Notice you","415","Already candidate action give money","WhiteSmoke","6","false","104.90","https://placeimg.com/625/181/any"
"106","Strong window young","30","Offer Democrat star travel","DarkKhaki","77","false","26.62","https://placekitten.com/983/730"
"107","Western culture say consider","380","This look at feel","MediumSlateBlue","67","true","112.99","https://placeimg.com/231/928/any"
"108","Crime meeting somebody","0","Inside car he ok too","PaleTurquoise","60","true","4.57","https://placekitten.com/842/528"
"109","Pass bad","354","Do happy large","Magenta","75","false","123.34","https://dummyimage.com/330x469"
"110","Sign area room","326","Return bed store near","Navy","44","true","225.74","https://placekitten.com/539/31"
"111","Seek collection authority into daughter","351","Scene some ten act weight","LemonChiffon","22","false","472.52","https://placeimg.com/862/30/any"
"112","Site policy relationship","278","Wide listen stop","AliceBlue","13","false","306.63","https://placeimg.com/560/398/any"
"113","Large poor fund","359","Visit song member cover lose","LightCyan","54","true","349.52","https://placeimg.com/747/971/any"
"114","Trouble owner agent the","318","Party PM maybe between thank","LightBlue","45","false","221.62","https://dummyimage.com/40x883"
"115","One student there policy yet","409","Owner break artist","White","42","false","136.52","https://placeimg.com/85/507/any"
"116","Center figure different still","279","Thus science own thing","MediumSlateBlue","60","true","54.17","https://placekitten.com/960/224"
"117","Mouth various child cultural base","362","Plan every each card street","Blue","22","true","57.60","https://placekitten.com/787/493"
"118","Church option sometimes pick their","73","Drug lose home soon","Gold","95","false","29.57","https://placeimg.com/775/7/any"
"119","Determine spring rise","358","Network bit someone","DarkCyan","65","true","457.93","https://dummyimage.com/991x8"
"120","Appear knowledge rich radio away","13","Their enjoy","Peru","18","true","142.94","https://dummyimage.com/423x80"
"121","Indeed idea","280","Center without look hundred","Ivory","84","false","39.11","https://placeimg.com/573/739/any"
"122","Determine let","442","Than option mean","SpringGreen","14","false","274.81","https://dummyimage.com/90x52"
"123","Include go message","289","Week director","DarkGray","71","true","307.00","https://placekitten.com/848/663"
"124","Close policy PM final","239","Only bill later","Orchid","94","false","341.81","https://placeimg.com/343/527/any"
"125","Discussion network then senior","217","Central need","OldLace","79","true","327.09","https://www.lorempixel.com/794/16"
"126","Western myself none late program","156","Case wonder","Cyan","36","true","474.91","https://placekitten.com/804/243"
"127","Most protect","363","Heavy record rule special","HotPink","66","false","166.56","https://placeimg.com/11/132/any"
"128","Beautiful difference report","327","Central road according plan","OrangeRed","73","true","367.71","https://placekitten.com/467/101"
"129","Protect professor process station up","407","Series dream yeah report garden","PeachPuff","41","true","187.53","https://placekitten.com/901/571"
"130","Somebody light","114","Eat among change","MediumVioletRed","91","false","18.72","https://placeimg.com/298/725/any"
"131","Plant five","13","Letter remember unit director bar","BlueViolet","7","false","262.32","https://placeimg.com/224/487/any"
"132","Talk party side","61","List would Democrat note","Sienna","79","false","298.98","https://placeimg.com/123/8/any"
"133","Charge lead music","81","Fill political give","Bisque","37","true","18.85","https://placeimg.com/841/448/any"
"134","Say if tough voice interesting","404","Price rise tell old some","MediumBlue","37","false","274.79","https://placekitten.com/317/191"
"135","Crime speak fill","76","Group top woman everyone quickly","SlateGray","67","true","423.49","https://placekitten.com/479/75"
"136","Today value become term","163","Year else front","Crimson","19","false","206.26","https://www.lorempixel.com/536/805"
"137","Its open upon","57","Series shoulder specific offer","RosyBrown","12","true","201.71","https://dummyimage.com/686x887"
"138","Worry kitchen white four","312","Hit resource interest","BlanchedAlmond","12","false","408.18","https://dummyimage.com/300x356"
"139","Gas black","189","Own would","Maroon","55","true","142.09","https://www.lorempixel.com/867/714"
"140","They probably hair","409","Vote yard adult","Gainsboro","89","false","451.28","https://dummyimage.com/889x857"
"141","Prevent the cultural","376","Director score general simply charge","WhiteSmoke","82","false","62.88","https://www.lorempixel.com/30/983"
"142","Child thought support project","30","Look true no remember","PaleGreen","52","false","61.80","https://dummyimage.com/461x980"
"143","Grow team whole","169","Finish boy single practice","SeaShell","61","false","117.42","https://dummyimage.com/162x748"
"144","Include material treatment","368","Sound be certainly fly","YellowGreen","1","false","163.67","https://www.lorempixel.com/1014/804"
"145","Morning their nation article build","9","Light box school despite suddenly","LawnGreen","100","true","117.93","https://www.lorempixel.com/153/800"
"146","Carry address quite reveal","412","Theory window see","Azure","60","true","307.72","https://www.lorempixel.com/269/877"
"147","One foreign space","272","Through action point theory","BlanchedAlmond","88","true","491.60","https://placeimg.com/900/322/any"
"148","Oil church story something","24","Option into western final","DarkTurquoise","1","false","278.36","https://www.lorempixel.com/745/984"
"149","Level despite imagine husband our","307","Policy painting car","SlateBlue","16","true","173.11","https://www.lorempixel.com/196/693"
"150","While the","72","Exist action","DarkKhaki","12","false","63.76","https://dummyimage.com/308x495"
"151","Account respond act","253","Government south detail","LightGray","46","true","305.64","https://placekitten.com/972/248"
"152","Four sea candidate","21","These series movement international toward","DeepPink","68","false","148.63","https://www.lorempixel.com/88/899"
"153","Wall hold task beat instead","155","Manager difference face will","Cornsilk","13","false","197.62","https://placeimg.com/471/225/any"
"154","Deep ball not","480","Republican radio","Green","52","false","459.44","https://dummyimage.com/885x445"
"155","Rule memory around international","279","Artist physical","CornflowerBlue","76","true","62.90","https://dummyimage.com/399x75"
"156","Water guess million by","120","Join brother","Sienna","74","true","88.80","https://placekitten.com/121/543"
"157","Expert near","191","Hear rock only","SkyBlue","45","true","308.91","https://dummyimage.com/648x475"
"158","Almost number stock else","58","Book station spend instead","NavajoWhite","31","false","86.16","https://placeimg.com/322/272/any"
"159","Kind phone popular seem","233","Must statement news","PapayaWhip","88","true","356.01","https://placeimg.com/584/97/any"
"160","Something than financial story","378","Sense yard work when arrive","Wheat","82","true","187.29","https://dummyimage.com/348x150"
"161","Way year large like however","216","Purpose nice program according action","LightSeaGreen","28","true","399.93","https://www.lorempixel.com/373/785"
"162","However bank make","98","Go too newspaper result","OliveDrab","97","true","126.54","https://dummyimage.com/376x150"
"163","Card story","170","Find media want","Snow","27","false","117.19","https://placeimg.com/372/158/any"
"164","Kid economic attorney fear because","105","Risk consider","LightSkyBlue","43","true","384.73","https://placekitten.com/151/830"
"165","Glass southern","211","Keep draw issue hair evening","Tan","3","true","292.72","https://placekitten.com/968/383"
"166","Bank large season pull","293","Something rule want piece","Salmon","48","false","142.28","https://dummyimage.com/687x152"
"167","Play during home those","148","College account article better understand","LightGray","41","false","13.41","https://dummyimage.com/41x937"
"168","Another wide country center","222","Wonder sure","MintCream","68","false","236.88","https://placekitten.com/955/285"
"169","Manage nearly bill","443","Practice bag plant","Azure","90","false","124.83","https://placeimg.com/653/962/any"
"170","Candidate suddenly","268","Crime building least somebody","DarkKhaki","43","true","354.96","https://dummyimage.com/779x29"
"171","Side start look avoid","243","Certainly couple choose wish","Aquamarine","54","true","270.85","https://www.lorempixel.com/259/833"
"172","Traditional mean style thing","211","Agent especially image","MintCream","88","false","29.07","https://placeimg.com/198/561/any"
"173","Small any wide expect no","272","Visit such case","LightGreen","21","false","442.02","https://www.lorempixel.com/662/802"
"174","Deep tree arrive blue one","454","Film treat","LightSlateGray","93","false","194.99","https://placeimg.com/584/147/any"
"175","Assume off mention","323","Worker deep everything","Olive","79","false","191.05","https://dummyimage.com/357x207"
"176","Seem truth","198","Purpose walk member around","DeepSkyBlue","8","false","122.80","https://dummyimage.com/356x456"
"177","Man general defense","3","Room create","Olive","14","true","401.31","https://www.lorempixel.com/840/158"
"178","Save drug start win","282","Until believe with state","MediumSpringGreen","37","true","398.75","https://placekitten.com/676/320"
"179","Day material","152","Quality movie explain store","Bisque","11","true","168.48","https://dummyimage.com/913x843"
"180","Course source oil","385","Lay memory campaign","DarkSlateGray","43","false","173.34","https://placeimg.com/99/710/any"
"181","Television consumer two good","140","Day forward wife","Magenta","73","false","423.72","https://placekitten.com/398/867"
"182","Head several expert whole","318","Position best blood","MediumSpringGreen","46","false","470.09","https://placekitten.com/887/28"
"183","Whether condition","54","Test again travel pass performance","Yellow","61","true","275.31","https://www.lorempixel.com/13/677"
"184","Near remember fly","329","Far car clear","MediumSlateBlue","59","true","495.44","https://www.lorempixel.com/680/542"
"185","Prepare economy focus society","22","Morning south member thing","GoldenRod","8","true","6.89","https://dummyimage.com/536x189"
"186","Matter sort sure","239","Mention fish compare Congress","SandyBrown","19","false","138.73","https://placekitten.com/713/181"
"187","Newspaper travel north of","203","Make person heavy","Cyan","14","false","291.32","https://placekitten.com/321/546"
"188","Continue soon specific mission","116","The party painting","GhostWhite","24","true","85.60","https://placeimg.com/670/287/any"
"189","Bill near","368","Give other mention","MediumSpringGreen","37","true","377.84","https://placekitten.com/135/199"
"190","Option himself tend play","78","Take teacher dark drive","DarkCyan","43","true","197.46","https://placekitten.com/972/467"
"191","Environmental to ahead them respond","298","Information feeling attorney station","DarkSlateGray","35","false","215.94","https://placekitten.com/679/169"
"192","Get plant fall international","214","Win call explain hotel","Thistle","30","true","44.84","https://placekitten.com/166/55"
"193","Field world","444","Economic authority network","Moccasin","22","true","370.41","https://dummyimage.com/664x203"
"194","Red anything enter","66","Short mind dog talk matter","DarkRed","91","true","65.28","https://placekitten.com/156/785"
"195","Financial from upon all","343","Give certainly seat out","PaleGoldenRod","7","false","218.33","https://dummyimage.com/75x255"
"196","Piece event hope teach skill","373","Important beautiful heart","YellowGreen","77","true","17.72","https://dummyimage.com/774x315"
"197","National ok store want short","18","Well let","LightSlateGray","26","true","186.15","https://dummyimage.com/925x113"
"198","Against control race thank despite","73","Discussion instead discussion","ForestGreen","34","true","159.34","https://placeimg.com/344/595/any"
"199","Drive school give","46","Current cell huge act","SlateGray","68","true","461.02","https://placeimg.com/916/740/any"
"200","Middle take","445","Major beyond","GhostWhite","69","true","213.84","https://placeimg.com/81/71/any"
"201","Well relate senior thousand","128","Force civil she","PapayaWhip","30","false","97.22","https://dummyimage.com/929x975"
