"802","Care bad across attack","50","Our system up reach","Gainsboro","2","true","153.78","https://placeimg.com/240/917/any"
"803","Help statement else itself toward","324","Plant laugh structure","SeaGreen","71","true","170.23","https://placeimg.com/623/497/any"
"804","Record price election effect","179","Image edge pretty big father","LightGoldenRodYellow","50","false","327.96","https://placekitten.com/932/983"
"805","Social where heart","71","Product the","SpringGreen","78","false","7.54","https://placekitten.com/631/84"
"806","Firm myself ago company another","489","Consumer no","Coral","26","false","293.24","https://placekitten.com/689/795"
"807","Mention style","358","Participant election will include","SteelBlue","42","true","134.94","https://placeimg.com/182/996/any"
"808","Treatment animal cause","389","Shoulder staff while ready","LightPink","68","false","150.94","https://placekitten.com/156/92"
"809","Law computer late we","187","Age cultural describe total","Green","57","false","235.40","https://dummyimage.com/987x103"
"810","Fill third wear","319","Unit seem society","Orchid","57","true","389.72","https://www.lorempixel.com/401/467"
"811","Over ability blood","191","Chair hair","DarkMagenta","6","false","391.90","https://placekitten.com/207/874"
"812","Hundred couple create","227","Decade future majority","Crimson","79","false","393.13","https://placeimg.com/51/738/any"
"813","Yard whose attack this","292","If whom happy view many","Aquamarine","0","true","248.17","https://www.lorempixel.com/417/268"
"814","Second bank many middle","66","But with yourself send push","Black","60","false","8.27","https://www.lorempixel.com/734/410"
"815","Surface lawyer cause factor","303","Miss responsibility","LightGray","6","true","274.43","https://placeimg.com/303/432/any"
"816","Nothing social report decade","73","Probably each","DarkGray","69","false","337.43","https://placekitten.com/393/148"
"817","News step","384","Table significant film particularly","MediumTurquoise","57","true","223.16","https://placekitten.com/1/300"
"818","Loss edge fear","27","Field away","LemonChiffon","83","true","487.87","https://placekitten.com/704/741"
"819","Off generation trip speech","248","Want fire fact","Aquamarine","91","true","471.95","https://dummyimage.com/319x830"
"820","Several policy production program","476","Enough decade difficult","LightSteelBlue","46","true","66.75","https://placekitten.com/335/213"
"821","Parent bed cell","172","Health turn","MediumAquaMarine","14","false","39.13","https://dummyimage.com/539x154"
"822","Seem personal here score","156","Event by space","AliceBlue","11","true","245.29","https://www.lorempixel.com/457/406"
"823","Raise audience term foot","31","Admit force brother","Thistle","14","true","437.51","https://dummyimage.com/862x14"
"824","Enter skin certainly article support","419","Interview street finish enter","DarkGreen","8","true","237.91","https://www.lorempixel.com/580/683"
"825","Year meeting","435","Soldier answer exist","SteelBlue","7","false","157.21","https://placekitten.com/411/768"
"826","Employee suggest until man","59","Behavior check","Orange","94","true","90.73","https://www.lorempixel.com/106/225"
"827","Data other learn","241","State receive","Blue","45","true","432.28","https://www.lorempixel.com/656/971"
"828","Board look off card officer","281","Hit day certainly door","Teal","88","false","211.04","https://placekitten.com/51/830"
"829","Child sea cover fine","227","As hotel manage situation","Aqua","26","true","345.46","https://placeimg.com/439/525/any"
"830","Thing stop happen major","319","Way key one","DarkKhaki","92","true","344.11","https://placekitten.com/890/8"
"831","Movie soon Mrs","353","Two worker country","Snow","15","false","251.73","https://placeimg.com/485/402/any"
"832","Enjoy still","42","Various good","Gainsboro","95","true","190.50","https://placekitten.com/437/367"
"833","Us quickly edge","297","Defense issue mission learn send","MediumBlue","31","true","169.62","https://www.lorempixel.com/111/461"
"834","Bar size outside","31","Line idea I author especially","DarkRed","28","true","378.49","https://dummyimage.com/369x398"
"835","No policy kind various","408","Enter glass drive project","DarkOrange","71","true","227.87","https://www.lorempixel.com/903/807"
"836","May method tough crime","295","Character pick away statement","White","26","true","265.06","https://placeimg.com/630/93/any"
"837","Minute seem force wear","200","Story each language","DarkSalmon","52","true","212.48","https://placekitten.com/122/335"
"838","Message as guy","30","Campaign prevent laugh","Linen","5","false","172.62","https://dummyimage.com/1x302"
"839","While analysis shake Republican","36","Interview wall","PapayaWhip","60","true","76.21","https://placeimg.com/574/711/any"
"840","Stage join","17","Do again go order vote","DarkGray","90","true","46.66","https://placekitten.com/661/770"
"841","Play deep","113","Scene democratic","Fuchsia","92","false","349.00","https://placeimg.com/497/399/any"
"842","Hear board main wonder situation","499","Expect player job","LightYellow","94","true","151.31","https://www.lorempixel.com/291/965"
"843","Authority paper city dream live","85","Brother street scene","PaleVioletRed","33","true","23.23","https://placekitten.com/492/387"
"844","Would president serious","2","Design book","SeaShell","33","true","37.54","https://placekitten.com/139/631"
"845","Cup be long entire decision","35","Democratic easy set old office","GreenYellow","4","false","420.73","https://placeimg.com/358/242/any"
"846","Lawyer real evening concern couple","16","But contain message","Orange","47","true","281.64","https://dummyimage.com/886x563"
"847","Education both boy but","130","Million knowledge","Gray","77","true","483.19","https://placeimg.com/875/624/any"
"848","Star appear often relationship","115","Table ready price film","LavenderBlush","97","false","318.45","https://dummyimage.com/584x116"
"849","Everyone strategy none garden","116","Win me at","LightSalmon","21","true","255.75","https://placeimg.com/769/496/any"
"850","Sign argue sport concern","151","Thought treatment","PowderBlue","62","false","75.61","https://placekitten.com/875/384"
"851","What risk wide","99","Relationship option movement bill","MintCream","37","false","46.30","https://placeimg.com/763/898/any"
"852","Establish son police name","309","May guy example economy","DarkMagenta","83","false","248.62","https://placekitten.com/564/187"
"853","Its range","243","Life week always ready","SpringGreen","1","false","458.65","https://dummyimage.com/418x677"
"854","Image keep benefit activity project","284","None final","LightSalmon","57","true","424.00","https://www.lorempixel.com/416/866"
"855","Summer increase law plant","33","Sometimes there","SandyBrown","34","false","173.33","https://www.lorempixel.com/267/779"
"856","Enough their environmental","72","Yes current","AliceBlue","44","false","253.26","https://www.lorempixel.com/308/313"
"857","House garden shake here","229","On area back early","DodgerBlue","22","false","398.15","https://www.lorempixel.com/938/787"
"858","Happy where actually offer","367","Easy establish gas old","SandyBrown","94","false","230.05","https://www.lorempixel.com/498/614"
"859","Difference project remember","75","Miss market official","Pink","71","false","376.73","https://placeimg.com/885/993/any"
"860","Network condition","410","Next not","Pink","81","true","248.67","https://placekitten.com/306/279"
"861","Option specific wait support official","455","Check land result under kid","DeepSkyBlue","45","true","223.54","https://dummyimage.com/733x156"
"862","Pattern government management military","417","Upon my education learn involve","ForestGreen","9","true","93.78","https://placeimg.com/712/300/any"
"863","Song our interview","251","Should tonight according teach","LemonChiffon","72","false","349.92","https://www.lorempixel.com/623/237"
"864","Word policy trip on require","405","Fight already","Chocolate","3","false","257.20","https://placekitten.com/744/615"
"865","Far price say size","405","Trade go represent","PaleGreen","26","true","239.82","https://dummyimage.com/507x486"
"866","Small research","119","Fine it to too","Magenta","19","false","308.73","https://dummyimage.com/310x798"
"867","Would peace mention blood","225","Consumer surface trouble firm","Yellow","7","true","398.42","https://placeimg.com/884/607/any"
"868","Learn low property against","292","Song nation away risk second","Ivory","29","true","113.28","https://placekitten.com/464/107"
"869","Send left","150","Across office among","PaleTurquoise","74","true","286.98","https://dummyimage.com/499x355"
"870","Popular six than land","37","Notice character","MediumSlateBlue","75","true","411.64","https://www.lorempixel.com/37/313"
"871","These amount","328","Type show college","LightGray","27","true","313.77","https://dummyimage.com/166x525"
"872","Standard morning","77","Test oil act","GreenYellow","23","true","357.65","https://dummyimage.com/491x576"
"873","College pretty product","202","Yet leader usually","Chocolate","12","true","147.94","https://placeimg.com/527/722/any"
"874","After at structure unit","318","Throw become several dinner structure","LightSlateGray","55","false","476.31","https://placeimg.com/509/328/any"
"875","Red recently fill wrong experience","174","Street international get commercial age","BlanchedAlmond","33","true","168.20","https://placeimg.com/646/442/any"
"876","Fly around move","223","Series treatment","DarkOrchid","73","true","414.77","https://placekitten.com/195/434"
"877","Budget first natural analysis all","167","Move them race when sort","Lavender","81","true","66.92","https://www.lorempixel.com/953/26"
"878","Generation her trip","271","Bed never","Ivory","48","true","375.80","https://www.lorempixel.com/583/172"
"879","Newspaper more","33","New reality","MediumSpringGreen","99","true","280.10","https://placekitten.com/238/519"
"880","Main too fly","364","Keep sell cover difference","Cyan","73","false","438.36","https://placeimg.com/777/434/any"
"881","Cup his","491","Require anyone","SandyBrown","23","true","89.88","https://dummyimage.com/134x327"
"882","Who book doctor decide main","5","Gas line time","Tan","16","true","149.81","https://placekitten.com/348/189"
"883","Family view participant again","408","Feeling everything people very","MistyRose","100","false","419.62","https://www.lorempixel.com/715/638"
"884","Become affect","307","Body writer cause music","GhostWhite","60","true","286.32","https://placeimg.com/973/161/any"
"885","Glass particular foot sing","211","Key TV future pull","RosyBrown","52","false","385.99","https://placeimg.com/477/122/any"
"886","Collection claim could order","257","National I","CadetBlue","33","true","466.61","https://placeimg.com/316/664/any"
"887","Listen operation again network","134","Everybody customer laugh face","MediumAquaMarine","61","false","497.06","https://placekitten.com/261/710"
"888","Event hour usually court","300","Fish interesting anything popular","Cyan","6","true","206.66","https://placekitten.com/331/313"
"889","Same approach third when","496","Edge good across","LightSeaGreen","26","false","40.51","https://www.lorempixel.com/298/21"
"890","Toward dog even table visit","267","Executive election wide cost full","Yellow","40","true","100.54","https://dummyimage.com/0x144"
"891","Pressure responsibility tax station","68","Summer network Mrs low","DarkOliveGreen","18","true","89.40","https://placeimg.com/120/56/any"
"892","Education truth","472","Tonight such","DarkTurquoise","6","false","437.55","https://www.lorempixel.com/882/16"
"893","Four indicate bit","385","Arrive since draw","OliveDrab","87","false","215.61","https://dummyimage.com/302x955"
"894","Simply in leg knowledge institution","243","Nothing house","AntiqueWhite","13","true","98.26","https://placeimg.com/688/939/any"
"895","Perhaps many","397","Provide drug interesting reality","SlateGray","93","true","361.13","https://placeimg.com/400/170/any"
"896","Sit final nation","138","Two if","LightSlateGray","71","false","189.44","https://www.lorempixel.com/904/284"
"897","Money herself ready","384","Should create seat authority city","DarkViolet","57","true","427.27","https://dummyimage.com/479x963"
"898","Everyone off we soldier","121","Toward back bring","BurlyWood","100","true","396.91","https://placeimg.com/407/935/any"
"899","Food a international simply","151","When maintain natural school","LightSkyBlue","66","true","257.02","https://placekitten.com/3/472"
"900","Wall region shake","7","School line executive apply","SpringGreen","48","true","379.25","https://placekitten.com/857/11"
"901","Eye bag skill study","456","Theory Democrat role memory","LavenderBlush","66","true","431.67","https://www.lorempixel.com/1015/12"
"902","Success call","348","Thank smile artist","DarkSlateGray","7","false","194.09","https://www.lorempixel.com/468/544"
"903","Can stop research point beyond","463","Find indeed like himself ability","MintCream","37","true","339.32","https://www.lorempixel.com/550/833"
"904","Guy themselves simple","98","Attorney agent goal","LightCoral","97","false","484.76","https://dummyimage.com/259x521"
"905","Day per","473","Fly skin fill rest","LightCoral","6","false","237.09","https://placekitten.com/439/253"
"906","Difficult television full hospital agency","279","Become room seven sell agent","LightYellow","80","true","164.59","https://placekitten.com/487/223"
"907","Newspaper know set try","261","Town audience boy seven matter","Cyan","34","false","232.41","https://placeimg.com/186/936/any"
"908","Weight foreign off computer push","67","Expect particular race","SpringGreen","55","true","25.61","https://dummyimage.com/14x771"
"909","Fill attorney scene","378","White laugh such","MidnightBlue","57","true","68.30","https://placekitten.com/466/285"
"910","Best seven senior","311","West pay your writer then","SaddleBrown","92","false","56.19","https://placekitten.com/503/327"
"911","Wear likely cup point","423","Foot generation","Chartreuse","34","true","70.50","https://placeimg.com/34/108/any"
"912","Value face than performance","106","Ball treat door as nearly","DarkTurquoise","20","true","245.35","https://placeimg.com/532/109/any"
"913","Billion oil minute","134","Example what","DarkGreen","53","false","112.07","https://www.lorempixel.com/509/518"
"914","Thank good economic provide","215","School hear skin medical popular","Azure","10","false","88.51","https://www.lorempixel.com/476/807"
"915","Development poor agency","447","Itself hand none peace","DarkSlateGray","14","true","351.57","https://dummyimage.com/525x579"
"916","Economy especially phone maybe wall","101","Glass guy natural the family","DarkBlue","73","true","348.11","https://www.lorempixel.com/194/440"
"917","Professional let authority","228","South however","DarkSlateGray","66","false","469.61","https://dummyimage.com/265x185"
"918","Culture dream","175","Minute call former drug","AntiqueWhite","14","false","97.66","https://placekitten.com/996/978"
"919","Point unit heart","449","Note century fund","Beige","94","false","16.60","https://dummyimage.com/660x682"
"920","Sometimes personal chair music","472","Nice policy its laugh","DarkGreen","55","true","370.94","https://placeimg.com/139/70/any"
"921","Leave yeah rich","99","Western less mother affect","LightGray","38","false","34.72","https://placeimg.com/147/179/any"
"922","Language enter year","194","Side want show","IndianRed","22","false","224.80","https://placeimg.com/96/143/any"
"923","Treatment effect single smile with","391","Door data add","DarkKhaki","100","true","346.97","https://placeimg.com/680/600/any"
"924","However race movie a mean","197","Peace various reveal","SpringGreen","3","false","3.15","https://placekitten.com/916/791"
"925","Nor then about","105","Entire now test decade","Teal","72","false","76.05","https://placeimg.com/799/972/any"
"926","Amount education dream budget","54","Give activity weight side others","DarkSlateGray","91","false","296.87","https://www.lorempixel.com/923/894"
"927","Although near commercial","399","Person thus anyone","Magenta","2","true","186.39","https://dummyimage.com/506x735"
"928","Hot management simple tax manager","250","Skill single defense","Crimson","76","true","406.45","https://dummyimage.com/851x361"
"929","Friend build join","348","Any thought thousand fly","IndianRed","70","true","128.57","https://placekitten.com/843/985"
"930","Chair man I eat century","237","Child ten wide community","Gainsboro","5","true","327.97","https://www.lorempixel.com/203/63"
"931","Not happen couple rule","16","Region minute news support","Ivory","88","false","305.34","https://placekitten.com/312/921"
"932","Past clearly collection","478","House memory stock win","PeachPuff","72","true","200.52","https://placeimg.com/434/860/any"
"933","Then same ball indeed","117","Federal person pick way","MediumSeaGreen","78","false","123.53","https://www.lorempixel.com/61/136"
"934","Cost position suffer","277","Grow good forget require","Lavender","44","true","153.93","https://www.lorempixel.com/592/319"
"935","Realize age","32","Window sing garden movie character","Red","29","false","46.19","https://placeimg.com/703/751/any"
"936","Officer within price","327","Focus personal others raise","SlateGray","88","true","151.47","https://www.lorempixel.com/974/552"
"937","Little three surface","445","Protect everything method","SkyBlue","37","false","260.76","https://placeimg.com/768/644/any"
"938","According look push","130","Save head knowledge middle","MediumOrchid","9","true","308.22","https://dummyimage.com/461x652"
"939","Movement control position save economic","92","Citizen fine until capital local","SteelBlue","8","false","183.84","https://www.lorempixel.com/456/698"
"940","Blood fire officer","219","When least way","PeachPuff","56","false","288.15","https://dummyimage.com/37x489"
"941","Community eat particular order","323","Congress religious early positive","MediumTurquoise","88","true","243.81","https://dummyimage.com/383x537"
"942","When term professor","42","Interesting them trial choose","Aquamarine","38","false","186.61","https://placeimg.com/882/89/any"
"943","Push wait remember thought","37","Accept detail environment","Thistle","88","true","474.63","https://dummyimage.com/501x856"
"944","Mind spend","130","Child already fact arrive","Black","0","false","116.56","https://dummyimage.com/476x413"
"945","Follow smile music somebody","283","Cold suffer think head","SlateBlue","88","true","277.63","https://www.lorempixel.com/85/944"
"946","That glass spring","275","Nearly practice huge","PapayaWhip","85","false","335.77","https://dummyimage.com/693x219"
"947","Father lose sell social","206","Past establish claim student","LightCoral","33","true","271.55","https://dummyimage.com/454x470"
"948","Together hard","31","Simply yet plan","DarkRed","31","true","184.46","https://placekitten.com/668/408"
"949","Be pay Republican","142","Good expect up become","DarkBlue","40","false","198.06","https://placekitten.com/68/240"
"950","Nor wear alone","69","Into believe","DarkSlateGray","88","false","328.32","https://www.lorempixel.com/986/733"
"951","Tough side well simple personal","461","Put first he image","DarkGreen","98","true","465.40","https://dummyimage.com/460x8"
"952","Out three include able","463","Least item list wish","Yellow","30","false","15.93","https://dummyimage.com/124x144"
"953","Loss sometimes","405","Almost performance","Thistle","42","true","88.77","https://placeimg.com/854/745/any"
"954","Half far always condition","67","One movement","SpringGreen","56","true","6.18","https://dummyimage.com/475x970"
"955","General value action performance race","1","Parent design door","PeachPuff","32","false","500.39","https://www.lorempixel.com/554/807"
"956","Experience glass end important successful","435","By Democrat floor shoulder","DarkSlateGray","69","false","312.55","https://dummyimage.com/75x966"
"957","Network western","225","Understand fight season","Indigo","27","true","440.06","https://placeimg.com/77/295/any"
"958","Everyone candidate","124","Public executive","DarkSlateBlue","83","true","204.94","https://placeimg.com/672/1/any"
"959","Detail beyond","408","Hair leave instead once","MediumBlue","10","true","409.78","https://placekitten.com/962/810"
"960","Station book consider miss","421","Quality born","LightSkyBlue","36","false","361.40","https://dummyimage.com/910x55"
"961","Child level someone market protect","435","Eight year once","Lime","11","true","407.22","https://www.lorempixel.com/277/571"
"962","No education watch","61","Near hear energy improve adult","LightCyan","90","false","1.73","https://placekitten.com/74/515"
"963","Visit certain clearly","145","Break hear at","AntiqueWhite","76","false","228.38","https://placekitten.com/73/75"
"964","Statement anyone most admit kitchen","209","Brother Republican","Red","87","false","283.18","https://www.lorempixel.com/232/931"
"965","Ready month","418","All phone staff","MediumVioletRed","46","false","218.85","https://dummyimage.com/530x806"
"966","Produce hotel budget me","298","Which nation amount","DeepPink","81","true","473.66","https://dummyimage.com/331x820"
"967","New answer money begin","227","Data high reach me","MediumOrchid","79","false","69.49","https://placekitten.com/650/838"
"968","Lawyer human","379","Break collection report law","MediumBlue","54","false","25.08","https://placeimg.com/764/24/any"
"969","Dinner spring prepare","21","Training character","Violet","7","true","183.51","https://placeimg.com/599/443/any"
"970","Move station section to","238","Police college","LightCoral","74","false","429.26","https://www.lorempixel.com/606/777"
"971","Leader democratic","193","Note star good give","Lavender","11","true","420.82","https://www.lorempixel.com/890/654"
"972","Early middle world","217","Alone stop","LightSlateGray","59","false","236.57","https://dummyimage.com/710x238"
"973","Yard newspaper war","493","Investment enter represent","DarkOrchid","42","true","438.31","https://www.lorempixel.com/714/692"
"974","Respond your right decade","295","Seem consider difference already","AntiqueWhite","64","false","483.47","https://placekitten.com/629/781"
"975","Better chance international cold","393","Natural require road","Lime","78","true","114.03","https://placekitten.com/158/208"
"976","Food minute","407","Rather wonder only","LightYellow","73","false","367.65","https://www.lorempixel.com/795/468"
"977","Explain seven various office","69","Reduce situation particularly give","Gray","8","false","478.08","https://placekitten.com/97/768"
"978","Those conference give","277","Identify great call scene","CornflowerBlue","32","false","443.52","https://www.lorempixel.com/346/333"
"979","Leader shake fight focus","51","Eat section line business practice","DarkSalmon","27","false","471.78","https://placekitten.com/747/483"
"980","Yes realize suffer floor","134","Head sport level","LightPink","28","false","160.64","https://placeimg.com/603/177/any"
"981","Discuss shake","405","House financial back","MediumVioletRed","46","true","162.02","https://placekitten.com/710/24"
"982","Common attorney","176","Animal employee serve","RoyalBlue","85","true","429.67","https://placeimg.com/665/418/any"
"983","Arm country often","414","Star identify according partner","DarkSlateBlue","25","true","430.06","https://www.lorempixel.com/781/265"
"984","Region another school around","407","Business hour can","DarkBlue","38","false","311.59","https://placeimg.com/605/293/any"
"985","Image west","227","Process phone","Cyan","86","false","107.56","https://dummyimage.com/378x248"
"986","Any item pattern","323","Too huge measure hotel","HoneyDew","72","false","114.61","https://placeimg.com/1007/399/any"
"987","Score score","59","Attorney participant special power","PowderBlue","84","false","56.94","https://placekitten.com/324/877"
"988","Yet research animal","406","Tell four much","BurlyWood","88","false","334.30","https://dummyimage.com/747x554"
"989","Worry time eat","201","Mr day","SaddleBrown","83","true","219.18","https://placeimg.com/648/393/any"
"990","Computer add left","217","Throughout gun sport beautiful","SeaShell","43","true","359.15","https://placekitten.com/571/874"
"991","Great many degree","378","Him beyond necessary","MediumVioletRed","35","true","166.94","https://dummyimage.com/708x572"
"992","Seem bed develop","481","Partner officer significant safe great","Green","74","false","437.12","https://www.lorempixel.com/429/81"
"993","Close quality democratic west property","458","Author someone everybody nice","LimeGreen","15","false","195.70","https://www.lorempixel.com/774/808"
"994","Young his open them","312","Force into campaign","Red","63","true","292.61","https://dummyimage.com/564x805"
"995","Growth mention argue boy","163","Later explain decide woman deal","Indigo","39","false","446.79","https://placeimg.com/378/988/any"
"996","Somebody cause Democrat","440","Education idea town","MediumBlue","78","false","0.05","https://dummyimage.com/886x412"
"997","Data news image little star","373","Away rock the exist although","Lavender","60","true","70.72","https://placeimg.com/581/24/any"
"998","Education above accept","419","Season drug data","DarkRed","7","false","383.60","https://placekitten.com/521/827"
"999","Conference likely usually","255","Practice your","NavajoWhite","18","false","304.14","https://dummyimage.com/893x209"
"1000","Side fight","493","Pass sport sell so","Violet","79","false","480.94","https://www.lorempixel.com/47/762"
"1001","Fear focus east hand","494","Coach the star certainly","Khaki","37","true","400.88","https://dummyimage.com/140x100"
"1002","Fund allow school","408","Learn arm suggest fire","MediumBlue","75","true","67.59","https://dummyimage.com/634x662"
"1003","Message walk year use","192","Nothing well program mention sing","Linen","36","true","460.51","https://www.lorempixel.com/712/87"
