"402","Risk article may area","493","Rich law support ground","HoneyDew","1","false","497.59","https://www.lorempixel.com/975/16"
"403","Foreign south factor","195","Mr everyone word question forget","Plum","17","true","27.81","https://placeimg.com/332/428/any"
"404","Significant need win forget","283","Executive I into discover","PowderBlue","54","false","87.98","https://placeimg.com/916/9/any"
"405","Spring son sure nature hit","202","Teach write again actually base","Indigo","45","true","291.60","https://placekitten.com/649/587"
"406","Available church","277","Face wide start rate prevent","MistyRose","11","false","43.74","https://placekitten.com/646/424"
"407","Maintain issue they","490","Indeed on commercial","Khaki","43","true","251.67","https://placeimg.com/175/905/any"
"408","Share sing long fast","204","Might challenge process into","Orange","22","false","272.45","https://placekitten.com/89/837"
"409","Necessary little cover indeed","4","Accept sport weight","Thistle","80","false","118.13","https://dummyimage.com/741x809"
"410","International series under without boy","369","Station step alone loss","GoldenRod","0","true","454.66","https://www.lorempixel.com/758/696"
"411","Necessary truth understand","347","Might section top","DeepSkyBlue","32","true","25.26","https://placeimg.com/502/995/any"
"412","Until candidate fight the notice","451","Action while","SpringGreen","41","true","279.49","https://placeimg.com/482/799/any"
"413","Whatever authority indicate use","77","Exist once then","Red","100","true","96.72","https://placekitten.com/993/957"
"414","Car whatever laugh","244","Western radio","SeaShell","1","false","469.98","https://placeimg.com/205/506/any"
"415","Write focus care him reduce","464","Other raise dinner better","Beige","1","false","295.23","https://placekitten.com/788/948"
"416","Theory crime top","12","Right conference involve miss degree","FireBrick","54","false","72.38","https://placeimg.com/708/657/any"
"417","Could politics reveal order","336","Remain feel industry west onto","PeachPuff","94","false","154.27","https://placekitten.com/326/128"
"418","Growth analysis authority","325","Company million get","MistyRose","25","true","380.02","https://www.lorempixel.com/781/601"
"419","Point name firm sing","154","Name energy east","DarkRed","21","false","102.93","https://dummyimage.com/207x854"
"420","Art television couple seem","395","Movie course reality other","PaleTurquoise","6","true","259.93","https://placeimg.com/591/760/any"
"421","Leave usually leg Democrat","127","Appear bad customer mind","Chocolate","34","true","442.74","https://dummyimage.com/900x842"
"422","Process hear develop","118","Trip enough detail worker","DarkGoldenRod","32","true","115.16","https://dummyimage.com/728x215"
"423","Guess station appear really","377","Talk action must hundred official","Peru","78","false","424.06","https://dummyimage.com/757x290"
"424","Include season full wish society","228","Send night","Gray","34","false","375.35","https://dummyimage.com/43x81"
"425","Door focus line late","255","Young society role news key","Chartreuse","25","true","379.40","https://dummyimage.com/487x574"
"426","Catch garden once","122","Chance condition able","SkyBlue","47","true","221.38","https://placekitten.com/379/241"
"427","Reach yes religious manager","318","Leader tough such","OldLace","53","false","134.85","https://placeimg.com/482/185/any"
"428","Note office bar head","254","Industry south song nothing","Azure","2","false","252.31","https://dummyimage.com/865x991"
"429","Benefit example analysis specific","55","Them official chance","MediumPurple","67","false","233.85","https://www.lorempixel.com/55/531"
"430","Great sense soldier goal carry","351","Strategy Mr reach","PaleGreen","0","true","258.44","https://placeimg.com/763/815/any"
"431","Military become down hair","151","Morning today memory room","Coral","35","true","67.82","https://placeimg.com/6/472/any"
"432","Himself list become","22","Conference better","CadetBlue","22","true","34.28","https://www.lorempixel.com/788/783"
"433","Wait manager future student fund","291","Able season","Gray","77","true","339.61","https://placeimg.com/483/286/any"
"434","Head sing watch","373","Bad she management upon","SeaShell","5","true","69.89","https://placekitten.com/408/919"
"435","Away with general have","12","Thus show heart daughter walk","CadetBlue","53","true","349.89","https://www.lorempixel.com/614/296"
"436","Class produce plant read wait","352","Prepare draw able","Green","75","false","82.50","https://placeimg.com/818/244/any"
"437","Side travel authority","381","System child there character","SandyBrown","15","false","244.85","https://www.lorempixel.com/425/16"
"438","Service expect past sport","318","Rise able question writer","Wheat","71","false","429.24","https://dummyimage.com/508x188"
"439","Congress close lead","437","Drug drug eat red","Green","44","true","387.27","https://placekitten.com/621/816"
"440","Mind country necessary land class","235","Either magazine senior","LightGreen","12","false","308.56","https://placekitten.com/942/405"
"441","Help meeting coach probably drug","321","Around owner make","LimeGreen","73","true","492.85","https://www.lorempixel.com/676/460"
"442","After north decade","30","Ready who","SeaGreen","96","true","252.19","https://www.lorempixel.com/915/271"
"443","Pm room also","71","Huge child beat war simply","DarkOliveGreen","7","true","223.64","https://placeimg.com/964/324/any"
"444","View much","467","Physical improve ever alone","OrangeRed","91","true","308.32","https://placekitten.com/132/971"
"445","Red pass dinner","309","Idea remember","MediumSeaGreen","46","true","261.13","https://www.lorempixel.com/778/333"
"446","Its network forward medical admit","493","Develop past school","Khaki","38","false","297.11","https://placekitten.com/238/130"
"447","Discuss expect change majority","401","Cultural fear hour kid","WhiteSmoke","66","true","254.76","https://placeimg.com/622/971/any"
"448","Early movie","490","Less protect card here","SkyBlue","74","false","467.78","https://www.lorempixel.com/285/164"
"449","Product wide little begin","212","Certainly that clear","Gainsboro","51","true","253.92","https://placeimg.com/890/1008/any"
"450","Appear ball move","103","According consumer","Plum","82","false","54.94","https://www.lorempixel.com/560/497"
"451","Sit other point","286","Audience word create","PowderBlue","16","true","93.32","https://placeimg.com/800/805/any"
"452","Still during analysis raise six","76","Reach myself notice vote","Magenta","43","true","465.54","https://placeimg.com/73/782/any"
"453","Account door skin company history","154","Budget among woman","WhiteSmoke","43","false","113.18","https://dummyimage.com/867x316"
"454","Tend official happy","254","Read deep","LightGoldenRodYellow","52","true","307.93","https://www.lorempixel.com/596/947"
"455","Effect itself personal college body","271","Start vote","DarkSalmon","22","false","96.89","https://www.lorempixel.com/15/864"
"456","Its clearly second","427","City of experience career final","MidnightBlue","71","false","353.13","https://dummyimage.com/597x581"
"457","Join determine right","232","Media cut","DodgerBlue","77","true","41.03","https://placeimg.com/280/396/any"
"458","Perhaps on reflect tell seven","326","Authority parent","White","93","true","441.73","https://placeimg.com/188/625/any"
"459","Live condition save international","344","Drive state low west","FireBrick","85","true","92.43","https://dummyimage.com/946x617"
"460","Month school unit current","425","Human yeah few","DarkOliveGreen","31","true","314.43","https://dummyimage.com/420x93"
"461","Bad analysis without","492","East side few suddenly","Black","10","true","71.73","https://dummyimage.com/640x278"
"462","Than organization happen catch technology","76","Open himself if per","Green","49","true","104.57","https://www.lorempixel.com/159/379"
"463","Happy almost rule none","9","All fall","FloralWhite","18","false","183.18","https://placeimg.com/869/614/any"
"464","Second during forget","258","Energy feel almost whatever","NavajoWhite","93","true","289.90","https://dummyimage.com/858x939"
"465","Nation we last where play","231","Deep light","OrangeRed","51","true","305.99","https://www.lorempixel.com/810/396"
"466","Person religious development","20","Determine pay foot fall","FireBrick","22","false","205.63","https://placeimg.com/684/933/any"
"467","Detail feeling behavior moment","93","Hear within believe","PapayaWhip","60","false","492.57","https://dummyimage.com/862x226"
"468","Brother late","494","Speak group fine set","DarkSalmon","1","true","422.14","https://dummyimage.com/303x725"
"469","Opportunity pay","221","Bad purpose and","SpringGreen","26","false","328.90","https://dummyimage.com/537x75"
"470","First civil time subject we","336","Market ready own skill and","PaleGreen","55","true","330.60","https://placeimg.com/539/626/any"
"471","Like manager director pretty design","128","Adult officer statement idea bit","SteelBlue","72","true","73.80","https://placeimg.com/600/152/any"
"472","Minute factor every","28","Pressure difficult","Bisque","20","true","309.41","https://www.lorempixel.com/293/981"
"473","Event term any ground","101","Gun direction sport reach","DodgerBlue","92","false","311.76","https://www.lorempixel.com/579/447"
"474","Fly couple begin treatment high","63","Cover design able maybe","Orange","93","false","395.06","https://placeimg.com/907/627/any"
"475","Sense fire","127","Executive former onto","Chocolate","51","false","121.83","https://dummyimage.com/117x767"
"476","East religious","95","Trial property democratic set figure","DodgerBlue","44","false","419.77","https://dummyimage.com/226x762"
"477","Sense respond price","219","Buy player staff page","LightGray","75","true","76.63","https://www.lorempixel.com/404/943"
"478","May hope keep budget","462","Reflect article method","LightSteelBlue","39","false","145.25","https://placeimg.com/591/474/any"
"479","Central national relationship million father","92","East star note campaign to","LightSeaGreen","36","false","166.29","https://dummyimage.com/436x647"
"480","Wrong as American might loss","101","Institution team could anything something","BlanchedAlmond","75","true","80.78","https://placeimg.com/692/586/any"
"481","If and rest","314","Huge science throughout upon lead","RoyalBlue","45","true","498.67","https://placeimg.com/117/492/any"
"482","Rise call role","140","Rest sound impact suggest","RoyalBlue","20","false","398.08","https://www.lorempixel.com/34/610"
"483","Art activity address movement since","497","Campaign technology phone writer","Gray","25","true","3.96","https://placekitten.com/559/576"
"484","Success sense energy local political","495","Simply sing everyone rather","Lavender","25","false","340.11","https://placeimg.com/2/372/any"
"485","Born laugh","463","Right ability sort","IndianRed","10","false","353.51","https://placeimg.com/158/757/any"
"486","Maintain democratic officer","480","Themselves society task as","Yellow","78","false","342.89","https://www.lorempixel.com/53/233"
"487","Process just","130","Easy development center end race","Navy","73","true","95.01","https://placeimg.com/737/280/any"
"488","Standard talk senior","442","By fly plan","Maroon","18","true","206.35","https://placeimg.com/495/398/any"
"489","Detail step might why upon","96","Forward talk on","MediumSeaGreen","40","false","343.28","https://www.lorempixel.com/947/287"
"490","Page billion probably month","258","Research task these per for","RoyalBlue","95","false","429.15","https://placekitten.com/923/189"
"491","Somebody very","292","Campaign attack other cup","Lavender","14","true","288.98","https://www.lorempixel.com/847/565"
"492","Result day situation whole religious","470","Thus recently","LightGray","25","false","108.67","https://dummyimage.com/103x528"
"493","Opportunity really that","263","Probably water course try lot","DodgerBlue","15","false","28.70","https://placeimg.com/133/565/any"
"494","Light end truth","180","Yeah teach health put part","DarkGreen","94","true","179.16","https://www.lorempixel.com/348/981"
"495","Rock bill bill","455","Record instead because","PowderBlue","55","true","475.40","https://placekitten.com/122/886"
"496","Order challenge become","268","Often feel","Sienna","8","true","252.49","https://placeimg.com/150/530/any"
"497","Clearly film imagine take bank","155","Democrat computer talk catch","Purple","67","true","355.82","https://www.lorempixel.com/735/555"
"498","Force quickly hot task","147","Kind forward","Orchid","87","true","197.57","https://www.lorempixel.com/205/205"
"499","Specific fear become stop","400","Degree hit again","Lavender","73","false","259.65","https://placeimg.com/535/307/any"
"500","Cold station upon draw","209","Lead population action talk","Gray","28","true","484.45","https://www.lorempixel.com/979/936"
"501","Personal guy store just","133","Join big up add history","PaleTurquoise","56","true","72.96","https://dummyimage.com/985x370"
"502","Part whose perhaps since","399","Open recently conference office travel","IndianRed","13","false","470.04","https://placeimg.com/360/674/any"
"503","Year year bank pretty","231","Yet experience score goal","Sienna","45","false","333.56","https://www.lorempixel.com/624/85"
"504","Send read","473","Attack room determine","Azure","2","false","377.26","https://placekitten.com/180/633"
"505","Half time","152","Opportunity week speech","SandyBrown","46","true","274.09","https://www.lorempixel.com/790/184"
"506","Meeting bar grow","219","Small film","FloralWhite","58","false","245.63","https://placekitten.com/549/682"
"507","Property reflect statement scene","345","Series stuff painting","DarkKhaki","47","false","471.01","https://www.lorempixel.com/222/503"
"508","Surface move attack","486","Human customer bar environment","Purple","35","false","339.37","https://placeimg.com/911/100/any"
"509","Blood available determine score","57","Similar crime","Lime","14","false","116.81","https://www.lorempixel.com/951/309"
"510","Career follow work","478","Expert official","PapayaWhip","19","true","456.60","https://dummyimage.com/856x432"
"511","Mr point down education available","428","Daughter officer","PapayaWhip","49","true","158.79","https://www.lorempixel.com/603/256"
"512","Thus all military","288","Woman ok base","CornflowerBlue","35","false","50.95","https://placeimg.com/494/578/any"
"513","Exist pretty make","175","Get until very environmental","DarkSeaGreen","60","true","444.07","https://dummyimage.com/287x14"
"514","Participant side authority receive method","56","Commercial store huge forward","Fuchsia","87","true","135.29","https://dummyimage.com/951x9"
"515","Become ago traditional eight","383","Sort rate","Teal","82","false","391.75","https://dummyimage.com/918x480"
"516","Tax investment public safe","479","Cost drug","RosyBrown","5","false","207.63","https://www.lorempixel.com/397/546"
"517","Ahead relate various realize","203","Nation me soldier","LightYellow","44","true","21.61","https://placekitten.com/433/877"
"518","Land information ten describe many","297","Ability choose common","LavenderBlush","32","true","2.53","https://placekitten.com/691/156"
"519","Another environmental","118","Care represent","Wheat","16","true","363.81","https://placekitten.com/1019/209"
"520","Their message","426","Protect common decade","MediumSeaGreen","37","false","255.58","https://dummyimage.com/168x141"
"521","Begin series","174","Growth exactly year size our","FireBrick","44","true","469.44","https://www.lorempixel.com/876/362"
"522","Probably base","334","Across few animal lose","White","16","false","487.73","https://placeimg.com/311/813/any"
"523","Eat go summer safe hit","135","Technology parent white","LightPink","62","true","438.52","https://dummyimage.com/278x507"
"524","Small culture","1","Would pattern explain real","LightSkyBlue","20","false","159.61","https://dummyimage.com/841x425"
"525","True group task peace least","318","In maybe","Gold","98","true","294.94","https://www.lorempixel.com/623/261"
"526","Alone focus generation protect","103","Police laugh manager","CadetBlue","57","false","314.27","https://placeimg.com/653/261/any"
"527","Detail open whom couple someone","326","News through consider to","Indigo","78","true","219.36","https://placeimg.com/572/10/any"
"528","Level less happy organization","257","Vote reflect alone course","DarkRed","82","true","122.02","https://placeimg.com/702/511/any"
"529","Fear prevent leader training","415","Stage want unit might","OldLace","79","false","99.63","https://placekitten.com/929/297"
"530","Cause believe whose nothing dinner","488","People evidence quite","Turquoise","77","false","33.09","https://placeimg.com/221/356/any"
"531","Successful case month hard","265","Fund parent notice","PaleVioletRed","95","false","164.47","https://www.lorempixel.com/677/447"
"532","World school management","185","Quickly successful keep remain south","LightGreen","36","true","459.06","https://placekitten.com/184/804"
"533","Best according ability hot","341","Perhaps fall character","DarkBlue","95","false","192.87","https://placeimg.com/670/384/any"
"534","Goal decision development","424","Action hundred significant","Aquamarine","17","true","367.81","https://dummyimage.com/866x203"
"535","Possible wish effort already","179","Event already","DarkViolet","38","true","94.41","https://www.lorempixel.com/517/579"
"536","Job mission leg","79","Difference friend determine dark","Chocolate","62","false","331.31","https://placekitten.com/391/503"
"537","Young many material home","191","Space woman soldier","SlateBlue","1","false","88.90","https://www.lorempixel.com/370/723"
"538","Hand short whom report","3","Price law entire trial nor","GoldenRod","92","true","404.84","https://www.lorempixel.com/827/1002"
"539","Let ahead get word","346","Quite baby too candidate","White","92","false","472.06","https://dummyimage.com/976x814"
"540","Ask fine feel","247","Decade thus prevent human white","Silver","47","false","121.83","https://www.lorempixel.com/260/93"
"541","Ability once western","21","Instead kitchen","MediumTurquoise","48","false","23.33","https://placekitten.com/510/816"
"542","While career in whatever","81","Goal dream cause","DarkRed","27","false","352.76","https://dummyimage.com/701x957"
"543","Maintain finally resource","195","Same area parent themselves","LavenderBlush","61","false","438.24","https://placekitten.com/599/691"
"544","Effort yard Congress everybody including","301","Eye could see push certain","White","58","true","309.65","https://placekitten.com/649/51"
"545","Down part since politics","343","Service knowledge none","LightSlateGray","62","false","136.13","https://placekitten.com/35/624"
"546","Along idea just","65","Artist edge difference","Bisque","26","false","230.01","https://dummyimage.com/680x89"
"547","Chance thing ability sell store","244","Wish relationship","LightBlue","0","false","377.16","https://placekitten.com/301/463"
"548","Involve around effect interview see","255","Manage though star forget force","MediumTurquoise","100","false","355.59","https://placekitten.com/53/407"
"549","Wind discover wonder official","179","Office federal attention front these","Cornsilk","98","false","357.03","https://dummyimage.com/912x92"
"550","Crime author behavior","134","Campaign far concern why","MediumOrchid","6","false","18.27","https://dummyimage.com/482x932"
"551","Do operation west","380","Away figure","Tan","88","false","364.50","https://placeimg.com/82/645/any"
"552","Marriage read amount","225","Less term within box","LightSteelBlue","24","true","462.60","https://placeimg.com/21/312/any"
"553","That indicate yes","63","Education each feel wide","LightSlateGray","10","false","467.11","https://placekitten.com/63/658"
"554","For goal college spring vote","196","Success recognize mean","Pink","42","true","333.27","https://placeimg.com/584/232/any"
"555","Throw blood rise investment","315","Bed bed","DarkGreen","65","false","412.22","https://placeimg.com/589/700/any"
"556","Audience whole reflect director","126","Of religious way citizen special","HotPink","64","false","257.16","https://www.lorempixel.com/64/139"
"557","Themselves let knowledge conference","46","Improve different enjoy","DarkGreen","60","true","233.20","https://www.lorempixel.com/803/636"
"558","Activity new conference wide","290","Look your describe fund","LightSlateGray","58","true","119.58","https://dummyimage.com/868x359"
"559","Hour consumer choose across","222","Method adult father","Moccasin","35","true","38.63","https://dummyimage.com/711x361"
"560","Statement field firm work","254","South understand live human mention","BlanchedAlmond","46","true","247.19","https://dummyimage.com/590x476"
"561","Plant them today","230","Attorney half third yourself","Cyan","12","false","219.20","https://placekitten.com/585/708"
"562","Can try","493","Condition improve total contain again","BlanchedAlmond","71","true","423.91","https://placekitten.com/634/665"
"563","Matter interest son","393","Him American","Orange","10","true","393.46","https://dummyimage.com/255x119"
"564","Sometimes way whose","311","Law cultural able during product","White","77","false","164.70","https://www.lorempixel.com/387/741"
"565","Only whole","485","Risk describe between heavy","Chocolate","10","true","276.70","https://www.lorempixel.com/17/890"
"566","Adult reduce","112","Term blue program customer","MediumSpringGreen","98","true","159.94","https://placekitten.com/136/486"
"567","Person sign she but education","89","Environmental win attention need because","Silver","75","false","141.50","https://placeimg.com/569/988/any"
"568","Bill smile everybody","123","Individual tonight","AntiqueWhite","2","true","466.50","https://placekitten.com/990/698"
"569","Police strong","297","Relationship property","DarkSlateGray","86","true","345.60","https://placeimg.com/324/441/any"
"570","Cost thing head view","73","Girl never study","BlanchedAlmond","67","false","51.53","https://dummyimage.com/431x407"
"571","Can kitchen evidence local","165","Market town community central","IndianRed","41","true","422.41","https://www.lorempixel.com/714/705"
"572","Truth positive theory song","122","Miss how","LightGray","49","true","205.78","https://dummyimage.com/760x210"
"573","Air deal stay evidence","348","Usually environmental","LightSkyBlue","63","false","349.28","https://placeimg.com/846/235/any"
"574","Nature less author wish","353","She amount technology","LemonChiffon","18","false","95.45","https://placeimg.com/492/244/any"
"575","Design face worker population role","439","None maybe pay","BlueViolet","94","true","208.96","https://www.lorempixel.com/402/768"
"576","Often I later","92","Treat civil analysis","MediumAquaMarine","97","false","409.74","https://www.lorempixel.com/507/114"
"577","Inside laugh scientist system tough","119","Political the imagine with field","Magenta","27","false","237.73","https://placekitten.com/274/800"
"578","Likely our for while","480","Tv student score","SlateGray","92","true","329.22","https://placeimg.com/719/229/any"
"579","Body despite air work","275","Really such two reason","DimGray","31","false","340.64","https://dummyimage.com/421x360"
"580","Other reality we","316","Hospital shake Democrat south lot","Linen","0","false","154.65","https://placekitten.com/92/495"
"581","Edge visit threat","433","Kind court","BurlyWood","88","true","481.53","https://dummyimage.com/510x619"
"582","Girl apply environment","136","Seat if","Beige","42","false","270.42","https://www.lorempixel.com/883/23"
"583","Bring dinner condition class","402","Position paper when","FireBrick","84","false","386.71","https://placeimg.com/712/95/any"
"584","Father subject common","170","Health better authority realize","MediumVioletRed","43","true","77.80","https://placekitten.com/88/64"
"585","Message alone also none staff","370","Mrs message cost","YellowGreen","94","true","235.46","https://placekitten.com/130/374"
"586","Consider notice doctor crime","70","Better give charge health","BlanchedAlmond","2","false","138.28","https://placeimg.com/568/831/any"
"587","Month avoid process blood","214","Art pretty buy adult","LightCyan","31","false","386.01","https://dummyimage.com/538x925"
"588","Form go create exactly","465","Strategy answer throughout raise","MediumSeaGreen","97","true","183.05","https://dummyimage.com/1022x202"
"589","Seat myself conference","17","Human white dark create","Red","95","true","84.36","https://www.lorempixel.com/491/249"
"590","Into alone","242","Yes phone us hotel","Gainsboro","62","false","444.06","https://placeimg.com/158/774/any"
"591","Allow per","481","Turn window statement stop","DarkRed","37","false","94.25","https://placekitten.com/21/303"
"592","Serve Democrat later single","192","Law risk","SeaGreen","15","true","85.58","https://placekitten.com/245/65"
"593","Man save inside","460","Ready world religious kind fly","MediumBlue","29","false","235.52","https://placekitten.com/102/319"
"594","Again or moment","249","Laugh father","MediumSeaGreen","89","true","296.28","https://placekitten.com/591/560"
"595","Indicate industry more","441","Yes middle night","Blue","38","true","347.35","https://dummyimage.com/143x209"
"596","Probably side eight through","195","Democrat go nearly office","OldLace","53","false","309.14","https://www.lorempixel.com/149/180"
"597","Despite follow pass","32","Fund soldier","LimeGreen","24","false","85.91","https://dummyimage.com/228x866"
"598","Trip foot five","355","Woman air","LightGreen","72","false","40.47","https://placeimg.com/1001/962/any"
"599","Glass future when end","67","Start always where","Moccasin","29","false","457.79","https://dummyimage.com/514x26"
"600","Both still rise military lot","146","Republican work","Peru","77","true","209.96","https://dummyimage.com/141x262"
